created_utc,title,selftext,score,num_comments,author,subreddit
1659319719,"get 6 free stocks worth $39-$12,600! plus get $5 of free crypto! get over 100 referral bonus stocks worth $30-$300k and up to 15 free apple stocks! 1 free apple stock guaranteed! no deposit required [usa only]",[deleted],1,1,[deleted],AllCryptoBets
1659323738,is it a good idea for an 18 year to hold saving in apple stock?,[removed],1,0,1999ToyotaPrius,stocks
1659334023,yes!!! buy apple stock. it’s a great long term investment.,,1,0,vikrammangal,TeensTradingStocks
1659353874,$meta stock ideas | awaiting buy signal based off 22 signals. ▶ explore more with a free trial at ultraalgo.com,,1,0,MudGroundbreaking,UltraAlgo
1659353989,$nvda stock ideas | awaiting short signal based off 25 signals. ▶ explore more with a free trial at ultraalgo.com,,1,0,Short_Algo,UltraAlgo
1659353999,$aapl stock ideas | awaiting short signal based off 8 signals. ▶ explore more with a free trial at ultraalgo.com,,1,0,Short_Algo,UltraAlgo
1659354059,$v stock ideas | awaiting short signal. 75% win rate based on 4 trades. profit factor is 4.29. ▶ explore more with a free trial at ultraalgo.com,,1,0,MudGroundbreaking,UltraAlgo
1659354062,$ma stock ideas | awaiting short signal. 66.67% win rate based on 3 trades. profit factor is 13.2. ▶ explore more with a free trial at ultraalgo.com,,1,0,MudGroundbreaking,UltraAlgo
1659354109,$avgo stock ideas | awaiting short signal based off 14 signals. ▶ explore more with a free trial at ultraalgo.com,,1,0,MudGroundbreaking,UltraAlgo
1659370447,"paul pelosi lost $341,365 on his recent trade of nvidia stock","Paul Pelosi  lost  $341,365  on his recent trade of Nvidia stock
The husband of House Speaker  Nancy Pelosi  sold more than  $4 million  worth of shares in software and computer-chip company Nvidia (NVDA) in July, publicly available financial disclosures show.
The trade by  Paul Pelosi  was executed on  July 26 , when he sold 25,000 shares at an average price of  $165.05  per share, for a total loss of  $341,365 .
Early in July, it was disclosed that  Paul Pelosi  had exercised call options for as much as  $5 million  worth of Nvidia stock ahead of deliberations in  Congress  about a bill that would boost the  U.S.  semiconductor industry.",8,2,upbstock,Optionmillionaires
1659375029,: nancy pelosi’s husband sells $4 million worth of nvidia stock at a major loss,,1,0,DISANews,StonkFeed
1659427412,"aapl price predictions - apple stock analysis for tuesday, august 2nd.",,2,1,TheWizzr,StockInvest
1659443829,$avgo stock chart ideas | awaiting short signal based off 10 signals on the 15-min chart. ⚡ simplify trading with chart ideas at ultraalgo.com,,1,0,Short_Algo,UltraAlgo
1659443847,"$ma stock chart ideas | awaiting buy signal based off 8 signals $2,898 net profit 3.58 profit factor 87% win rate. ⚡ simplify trading with chart ideas at ultraalgo.com",,1,0,MudGroundbreaking,UltraAlgo
1659443942,$msft stock chart ideas | awaiting short signal. 83.33% win rate based on 6 trades. profit factor is 22.27. ⚡ simplify trading with chart ideas at ultraalgo.com,,1,0,Short_Algo,UltraAlgo
1659443986,"$aapl stock chart ideas | awaiting buy signal based off 8 signals $1,624 net profit 8.31 profit factor 87% win rate. ⚡ simplify trading with chart ideas at ultraalgo.com",,1,0,Short_Algo,UltraAlgo
1659443990,$meta stock chart ideas | awaiting buy signal based off 8 signals on the 15-min chart. ⚡ simplify trading with chart ideas at ultraalgo.com,,1,0,MudGroundbreaking,UltraAlgo
1659444035,"$v stock chart ideas | awaiting buy signal based off 10 signals $2,974 net profit 8.47 profit factor 90% win rate. ⚡ simplify trading with chart ideas at ultraalgo.com",,1,0,Short_Algo,UltraAlgo
1659444048,"$nvda stock chart ideas | awaiting buy signal based off 8 signals $1,892 net profit 4.08 profit factor 87% win rate. ⚡ simplify trading with chart ideas at ultraalgo.com",,1,0,Short_Algo,UltraAlgo
1659445729,$meta stock,"$META stock hold 158.23 support area or breakdown? analysis [https://stockconsultant.com/?META](https://stockconsultant.com/?META)

[META stock chart](https://preview.redd.it/4div62ljuaf91.png?width=1537&amp;format=png&amp;auto=webp&amp;s=a96b5e8fff1c4411a27c8b9610bdc071b2e3d2d4)

\#investing #money #wallstreet #stockmarket #stocks",2,3,StockConsultant,StockConsultant
1659448091,pelosi's husband dumps nvidia stock as house eyes chip bill,[deleted],1,0,[deleted],u_amel_iorationseale
1659448199,apple stock app what doing? 🫠,,0,3,iamShorteh,Superstonk
1659455492,pelosi&amp;#x27;s husband dumps nvidia stock as house eyes chip bill,,1,0,Turbulent_Pen9471,u_Turbulent_Pen9471
1659459120,'pelosi's husband dumps nvidia stock as house eyes chips',"The husband of U.S. House Speaker Nancy Pelosi sold his stake in chipmaker Nvidia (NVDA.O) on Tuesday, days after the House is expected to consider legislation to provide more than $70 billion worth of subsidies and taxes Credits to boost the U.S. semiconductor industry.

https://preview.redd.it/ufzmanlbybf91.jpg?width=960&amp;format=pjpg&amp;auto=webp&amp;s=faa8e8b47fb9a830be6f19e457f3b5dc2ad6bb7d",1,0,Fun-Election6109,u_Fun-Election6109
1659485078,nancy pelosi's husband sells $4 million worth of nvidia stock at a major loss | morningstar,,1,0,ChipmunkBulky6874,investmentthoughts
1659485207,pelosi's husband dumps nvidia stock as house eyes chip bill | reuters,,1,0,ChipmunkBulky6874,investmentthoughts
1659489506,"certified cpas blast trash stocks, analyze apple stock earnings, stock market crash and recession",,1,0,goatseboi,FinanceSex
1659489608,wrecked! meta stock q2 earnings disaster! financial education jeremy and i are clowns,,1,0,goatseboi,FinanceSex
1659491906,pelosi's husband dumps nvidia stock as house eyes chips,,1,0,RonEriccc,u_RonEriccc
1659491999,"pelosi's husband dumps nvidia stock as house eyes chip billjuly 27 (reuters) - u.s. house speaker nancy pelosi's husband sold his shares of chipmaker nvidia (nvda.o) on tuesday, days before the house is expected to consider legislation providing subsidies and tax credits worth over $70 billion to bo","In a periodic transaction report, the senior Democrat disclosed that her husband, financier Paul Pelosi, sold 25,000 shares of Nvidia for about $4.1 million, ending up with a loss of $341,365.",1,0,Plus_Cake5349,u_Plus_Cake5349
1659494258,the missouri republican sent a letter to senate homeland security and governmental affairs committee chairman gary peters (d-mich.) last week about a proposal to ban members of congress and their spouses from insider stock trading and cited paul pelosi’s purchase of the nvidia stock.,,1,0,RonEriccc,u_RonEriccc
1659496471,pelosi's husband dumps nvidia stock as house eyes chip bill by noel randewich," 

July 27 (Reuters) - U.S. House Speaker Nancy Pelosi's husband sold his shares of chipmaker Nvidia [**(NVDA.O)**](https://www.reuters.com/companies/NVDA.O) on Tuesday, days before the House is expected to consider legislation providing subsidies and tax credits worth over $70 billion to boost the U.S. semiconductor industry.

In a periodic transaction report, the senior Democrat [**disclosed**](https://disclosures-clerk.house.gov/public_disc/ptr-pdfs/2022/20021438.pdf) that her husband, financier Paul Pelosi, sold 25,000 shares of Nvidia for about $4.1 million, ending up with a loss of $341,365.

Advertisement · Scroll to continue

Paul Pelosi frequently trades shares of companies popular with many investors, including Apple [**(AAPL.O)**](https://www.reuters.com/companies/AAPL.O), Microsoft [**(MSFT.O)**](https://www.reuters.com/companies/MSFT.O) and other tech companies.

Transaction reports filed by Pelosi, a multi-millionaire, show her husband bought 5,000 Nvidia shares in July 2021, and that he exercised options to buy another 20,000 Nvidia shares last June.

The Senate is expected to vote on final passage in coming days of legislation providing about $52 billion in government subsidies for U.S. semiconductor production, as well as an investment tax credit for chip plants estimated to be worth $24 billion.

Advertisement · Scroll to continue

The legislation, which aims to make the domestic chip industry more competitive with China's, would then be taken up in the U.S. House under Pelosi's direction.

Last year, Pelosi defended the rights of federal lawmakers to trade stocks, but she later responded to calls for a ban on trading by lawmakers by signaling willingness to potentially advance such legislation.

A 2012 law makes it illegal for lawmakers to use information from their work in Congress for their personal gain. The law requires them to disclose stock transactions by themselves or family members within 45 days.

Advertisement · Scroll to continue

An [**analysis**](https://unusualwhales.com/i_am_the_senate/full) by Unusual Whales, a service selling financial data, concluded that congressional lawmakers last year traded $290 million in stocks, options, cryptocurrency and other assets, and that they outperformed the market, on average.

Santa Clara, California-based Nvidia is most valuable U.S chipmaker.",1,0,Minute-Astronaut-143,China_irl_irl
1659497858,pelospelosi's husband dumps nvidia stock as house eyes chipsi&amp;#x27;s husband dumps nvidia stock as house eyes chip bill,,1,0,1Heuknabi,u_1Heuknabi
1659527538,how do you feel about the apple stock for the long term? why to keep it or why not?,[removed],1,0,ribbit1708,stocks
1659533624,1 surprising catalyst for apple stock,,1,0,NewsElfForEnterprise,News_IT
1659533674,microsoft stock technical analysis | $msft price predictions,,1,0,CenteredTrading,u_CenteredTrading
1659535199,"nancy, are you sure $nvidia stock is worth wwiii?",,1,1,daglizzygobbler,PoliticalHumor
1659560906,dow jones surges amid strong data; elon musk makes this legal move amid twitter fight; apple stock pops - investor's business daily,,1,0,iDevice_Help,Elon_musketeers
1659561984,"trade apple stock in w/ daily 1.5x leverage, or -1x inverse exposure",,0,0,DirexionETFs,u_DirexionETFs
1659575706,husband dumps nvidia stock as house eyes chip bill,[deleted],1,0,[deleted],u_grupemennie9
1659577888,reuters: 'pelosi's husband sells nvidia stock as house eyes chips',,1,0,Appropriate_Guest_40,u_Appropriate_Guest_40
1659623873,nancy pelosi's husband sells $4 million worth of nvidia stock at a major loss,,1918,379,Ligamentactor,news
1659628528,nvidia stock to tank,[removed],1,2,Ok_Tomorrow_4221,wallstreetbets
1659628559,why i'm buying nvidia stock,[removed],0,1,PickleRee4life,nvidia
1659635697,"anyone notice how that one article you could read under gme on apple stock app that said, “wait, maybe this amtd isn’t connected to meme stocks after all” is gone today? poof.",[removed],1,0,Cit1es,Superstonk
1659636391,"anyone else notice that 2nd article under gme on the apple stock app yesterday that said, “wait, nvm meme /apes had nothing to do with that run up of the fake hong kong company and we might have posted wrong info because it’s not even publicly tradable…. yeah that article is gone today. poof…",[removed],21,3,[deleted],amcstock
1659637165,"anyone notice they deleted the 2nd article on the apple stock app today from yesterday that said, wsb/meme/apes actually had nothing to do with that hong kong fake bullshit because it’s not even publicly fuckin trade able.",[removed],3,1,[deleted],wallstreetbets
1659663254,pelosi's husband dumps nvidia stock as house eyes chip bill by noel randewich 2 minute read nvidia logo shown at siggraph 2017 inauguration of joe biden as the 46th president of the united states nvidia logo shown at siggraph 2017 1/2 speaker of the house nancy pelosi arrives with her husban," 

# Pelosi's husband dumps Nvidia stock as House eyes chip bill

**By** [**Noel Randewich**](https://www.reuters.com/authors/noel-randewich/)

2 minute read📷📷📷1/2

Speaker of the House Nancy Pelosi arrives with her husband Paul Pelosi during the inauguration of Joe Biden as the 46th President of the United States on the West Front of the U.S. Capitol in Washington, U.S., January 20, 2021. REUTERS/Jonathan Ernst/Pool

###### Register now for FREE unlimited access to Reuters.com

Register

July 27 (Reuters) - U.S. House Speaker Nancy Pelosi's husband sold his shares of chipmaker Nvidia [**(NVDA.O)**](https://www.reuters.com/companies/NVDA.O) on Tuesday, days before the House is expected to consider legislation providing subsidies and tax credits worth over $70 billion to boost the U.S. semiconductor industry.

In a periodic transaction report, the senior Democrat [**disclosed**](https://disclosures-clerk.house.gov/public_disc/ptr-pdfs/2022/20021438.pdf) that her husband, financier Paul Pelosi, sold 25,000 shares of Nvidia for about $4.1 million, ending up with a loss of $341,365.

Advertisement · Scroll to continue

Paul Pelosi frequently trades shares of companies popular with many investors, including Apple [**(AAPL.O)**](https://www.reuters.com/companies/AAPL.O), Microsoft [**(MSFT.O)**](https://www.reuters.com/companies/MSFT.O) and other tech companies.

Transaction reports filed by Pelosi, a multi-millionaire, show her husband bought 5,000 Nvidia shares in July 2021, and that he exercised options to buy another 20,000 Nvidia shares last June.

The Senate is expected to vote on final passage in coming days of legislation providing about $52 billion in government subsidies for U.S. semiconductor production, as well as an investment tax credit for chip plants estimated to be worth $24 billion.

Advertisement · Scroll to continue

The legislation, which aims to make the domestic chip industry more competitive with China's, would then be taken up in the U.S. House under Pelosi's direction.

Last year, Pelosi defended the rights of federal lawmakers to trade stocks, but she later responded to calls for a ban on trading by lawmakers by signaling willingness to potentially advance such legislation.

A 2012 law makes it illegal for lawmakers to use information from their work in Congress for their personal gain. The law requires them to disclose stock transactions by themselves or family members within 45 days.

Advertisement · Scroll to continue

An [**analysis**](https://unusualwhales.com/i_am_the_senate/full) by Unusual Whales, a service selling financial data, concluded that congressional lawmakers last year traded $290 million in stocks, options, cryptocurrency and other assets, and that they outperformed the market, on average.

Santa Clara, California-based Nvidia is most valuable U.S chipmaker.",1,0,Minute-Astronaut-143,China_irl_irl
1659682397,nvidia stock as house eyes chip bill," 

# Pelosi's husband dumps Nvidia stock as House eyes chip bill[https://www.reuters.com/markets/us/pelosis-husband-dumps-nvidia-stock-house-eyes-chip-bill-2022-07-27/](https://www.reuters.com/markets/us/pelosis-husband-dumps-nvidia-stock-house-eyes-chip-bill-2022-07-27/)",1,0,SomewhereOk7798,u_SomewhereOk7798
1659697292,is microsoft stock a buy?,,1,0,NewsElfForEnterprise,News_Microsoft
1659703768,why meta platforms stock can rebound nicely from here,,1,0,NewsElfForEnterprise,News_facebook
1659705659,pelosi's h pelosi's husband dumps nvidia stock as house eyes chip billusband dumps nvidia stock as house eyes chip bill,[removed],0,1,Impossible-Duck-7858,poland
1659716110,$meta stock chart ideas | awaiting short signal based off 15 signals on the 15-min chart. ▶ start a free trial at https://t.co/ox1gfgcqq2 https://t.co/dal3swsfti,,1,0,MudGroundbreaking,UltraAlgo
1659752747,"sometimes there's a ma.n.. i won't say a hero, 'cause, what's a hero? but sometimes, there's a man.",,1,0,bathworshipper,lebowski
1659801484,pelosi's husband sells nvidia stock as house watches for chips,,1,0,Tom_Yun,u_Tom_Yun
1659878008,should you really follow warren buffett's lead on apple stock?,,1,1,NewsElfForEnterprise,News_Finance
1659878587,miko sends apple stock into freefall,,92,1,Drow1234,Hololive
1659916193,why nvidia stock rose more than 19% in july,,1,0,NewsElfForEnterprise,News_Semiconductor
1659922389,pelosi's husband dumps nvidia stock as house eye," 

July 27 (Reuters) - U.S. House Speaker Nancy Pelosi's husband sold his shares of chipmaker Nvidia [(NVDA.O)](https://www.reuters.com/companies/NVDA.O) on Tuesday, days before the House is expected to consider legislation providing subsidies and tax credits worth over $70 billion to boost the U.S. semiconductor industry.

In a periodic transaction report, the senior Democrat [disclosed](https://disclosures-clerk.house.gov/public_disc/ptr-pdfs/2022/20021438.pdf) that her husband, financier Paul Pelosi, sold 25,000 shares of Nvidia for about $4.1 million, ending up with a loss of $341,365.",1,0,Cultural-Survey8910,adasdasg
1659958900,"meta stock analysis, facebook's transition to reels and metaverse",,1,0,ugos1,MetaStock
1659967804,are you buying nvidia stock or nvda calls at today's gap down from $190 to $175?,"Are you buying Nvidia stock or NVDA calls at today's GAP down from $190 to $175? Our mods at the Wattum discord channel provided the signal for a quick 70%+ base hit.

[NVDA Call Option Signal](https://preview.redd.it/kxkr7uhbzhg91.jpg?width=505&amp;format=pjpg&amp;auto=webp&amp;s=3e4cd6b7f21c6559531c88e373c8f3fc514794b7)

Join us for Bitcoin and crypto stock trading discussion and find out what is our projection via the link below:

[bitcoin-stocks-and-trading](https://discord.com/channels/930579200727982110/1006186103071576064)

https://preview.redd.it/d0syje9ayhg91.png?width=1284&amp;format=png&amp;auto=webp&amp;s=ea74176519f5bd230e1b7c84d320832708da2d96

[View Poll](https://www.reddit.com/poll/wj9th5)",1,3,wattumofficial,wattum
1659972526,earnings results: nvidia stock tumbles after company says revenue fell way shy of expectations,,1,0,DISANews,StonkFeed
1659978875,nvidia stock tumbles after company says revenue fell way shy of expectations,[removed],14,2,[deleted],stocks
1659984425,nvidia stock tumbles after company says revenue fell way shy of expectations | market watch,,3,0,kv_87,DailyTechNewsShow
1659987829,huge nvidia earnings miss! | nvda stock | preliminary q2 results,,1,0,SquigglyHarding1658,u_SquigglyHarding1658
1659991883,nvidia stock sinks - is this why nancy went to china?,,6,3,RaisinL,trump
1660001340,what did you think would happen to apple stock after steve jobs died in 2011?,[deleted],0,8,[deleted],stocks
1660030184,pelosi’s husband dumps nvidia stock as house eyes chip bill,"&amp;#x200B;

https://preview.redd.it/ifp389nf4ng91.jpg?width=992&amp;format=pjpg&amp;auto=webp&amp;s=b7d2dc7f192ee925f6bef5eb216db0426839b235

https://preview.redd.it/t163l9nf4ng91.jpg?width=993&amp;format=pjpg&amp;auto=webp&amp;s=a699aeb6d95484023b165f4a6b41c75748b37f84

 

[https://www.reuters.com/markets/us/pelosis-husband-dumps-nvidia-stock-house-eyes-chip-bill-2022-07-27/](https://www.reuters.com/markets/us/pelosis-husband-dumps-nvidia-stock-house-eyes-chip-bill-2022-07-27/)

July 27 (Reuters) — U.S. House Speaker Nancy Pelosi’s husband sold his shares of chipmaker Nvidia [(NVDA.O)](https://www.reuters.com/companies/NVDA.O) on Tuesday, days before the House is expected to consider legislation providing subsidies and tax credits worth over $70 billion to boost the U.S. semiconductor industry.

In a periodic transaction report, the senior Democrat [disclosed](https://disclosures-clerk.house.gov/public_disc/ptr-pdfs/2022/20021438.pdf) that her husband, financier Paul Pelosi, sold 25,000 shares of Nvidia for about $4.1 million, ending up with a loss of $341,365.

Paul Pelosi frequently trades shares of companies popular with many investors, including Apple [(AAPL.O)](https://www.reuters.com/companies/AAPL.O), Microsoft [(MSFT.O)](https://www.reuters.com/companies/MSFT.O) and other tech companies.

Transaction reports filed by Pelosi, a multi-millionaire, show her husband bought 5,000 Nvidia shares in July 2021, and that he exercised options to buy another 20,000 Nvidia shares last June.

The Senate is expected to vote on final passage in coming days of legislation providing about $52 billion in government subsidies for U.S. semiconductor production, as well as an investment tax credit for chip plants estimated to be worth $24 billion.

The legislation, which aims to make the domestic chip industry more competitive with China’s, would then be taken up in the U.S. House under Pelosi’s direction.

Last year, Pelosi defended the rights of federal lawmakers to trade stocks, but she later responded to calls for a ban on trading by lawmakers by signaling willingness to potentially advance such legislation.

A 2012 law makes it illegal for lawmakers to use information from their work in Congress for their personal gain. The law requires them to disclose stock transactions by themselves or family members within 45 days.

An [analysis](https://unusualwhales.com/i_am_the_senate/full) by Unusual Whales, a service selling financial data, concluded that congressional lawmakers last year traded $290 million in stocks, options, cryptocurrency and other assets, and that they outperformed the market, on average.

Santa Clara, California-based Nvidia is most valuable U.S chipmaker.",1,0,Old-Pass5790,u_Old-Pass5790
1660031770,"aapl price predictions - apple stock analysis for monday, august 9th.",,1,0,TheWizzr,StockInvest
1660046014,meta platforms stock: value play or value trap?,,1,0,NewsElfForEnterprise,News_facebook
1660056029,nvidia stock: 4 things investors should note from preliminary results,,1,0,NewsElfForEnterprise,News_Nvidia
1660115494,pelosi's husband sells nvidia stock as house eyes chips," Pelosi's husband dumps Nvidia stock as House eyes chip bill  
[https://www.reuters.com/markets/us/pelosis-husband-dumps-nvidia-stock-house-eyes-chip-bill-2022-07-27/](https://www.reuters.com/markets/us/pelosis-husband-dumps-nvidia-stock-house-eyes-chip-bill-2022-07-27/)  
July 27 (Reuters) - U.S. House Speaker Nancy Pelosi's husband sold his shares of chipmaker Nvidia (NVDA.O) on Tuesday, days before the House is expected to consider legislation providing subsidies and tax credits worth over $70 billion to boost the U.S. semiconductor industry.",1,0,feiqingzhang,u_feiqingzhang
1660117794,"nvda price predictions - nvidia stock analysis for wednesday, august 10th",,1,0,TheWizzr,StockInvest
1660122712,"aapl price predictions - apple stock analysis for wednesday, august 10th.",,1,0,TheWizzr,StockInvest
1660126735,apple stock edges higher despite cautious smartphone outlook from supplier foxconn,,1,0,NewsElfForEnterprise,News_Manufacture
1660131588,nvidia stock,[removed],1,0,Ok-Carpet5691,StocksAndTrading
1660148829,why nvidia stock was down on tuesday,,1,0,NewsElfForEnterprise,News_Nvidia
1660154232,nvidia stock: panic or opportunity? is it a buy now?,,1,0,NewsElfForEnterprise,News_Nvidia
1660154569,"is this youtuber scamming: akahat says dr burry is buying stocks he bought apple, portfolio clearly says put option on apple, how is dr burry buying stocks when he is betting on fall of apple stock or is akshat scamming for views",,37,40,Remarkable_Ad_1660,IndianStreetBets
1660160250,aapl stock eyes home run as top funds place $1.7 billion bet,,2,0,GTA_Stock_Prophet,investorsobserver
1660196140,"nvda price predictions - nvidia stock analysis for thursday, august 11th",,1,0,TheWizzr,StockInvest
1660196273,"aapl price predictions - apple stock analysis for thursday, august 11th",,1,0,TheWizzr,StockInvest
1660208778,alphabet stock,"Been wanting to get into stocks for a long time and yesterday after doing some research made the plunge with alphabet.

From what I could gather it’s gone down recently due to recession concerns around the market but the company performance has not slowed and there is massive room for growth in the future.

Just wondered if there’s anything I’ve missed about why this might not be a good investment",25,39,PuzzleheadedChart122,stocks
1660229712,meta stock technical analysis | $meta price predictions,,1,0,CenteredTrading,u_CenteredTrading
1660238368,$nvda stock chart ideas | awaiting buy signal based off 10 signals on the 15-min chart. ▶ start a free trial at ultraalgo.com,,1,0,MudGroundbreaking,UltraAlgo
1660255343,the curious reason nvidia stock popped today,,1,0,NewsElfForEnterprise,News_Nvidia
1660262094,is apple stock good for a dividend portfolio? warren buffett would have answered 'yes'!!!,,678,105,Ilovemyhometown,dividends
1660287077,"aapl price predictions - apple stock analysis for friday, august 12th",,1,0,TheWizzr,StockInvest
1660290212,"msft price predictions - microsoft stock analysis for friday, august 12th",,1,0,TheWizzr,StockInvest
1660295146,"nvda price predictions - nvidia stock analysis for friday, august 12th",,1,0,TheWizzr,StockInvest
1660299156,apple stock edges higher after report indicates iphone demand confidence,,1,0,NewsElfForEnterprise,News_Manufacture
1660308834,dow jones futures rise as apple stock nears buy point,"[https://finance.yahoo.com/m/0f1a84d0-b4ac-3fb7-8362-7d6e30aff3cd/dow-jones-futures-rise-as.html](https://finance.yahoo.com/m/0f1a84d0-b4ac-3fb7-8362-7d6e30aff3cd/dow-jones-futures-rise-as.html)

 Dow Jones futures rose Friday, looking to cap a solid weekly gain as both the Nasdaq composite and S&amp;P 500 set sights on their fourth straight weekly advance. Tech titan Apple stock is closing in on its latest buy point, as it heads for a six-week win streak. 

On Thursday, the Dow Jones Industrial Average trimmed a 1% gain to just 0.1%, while the S&amp;P 500 reversed slightly lower. The tech-heavy Nasdaq composite ended down 0.6%, after an early 1.3% rally found stout resistance around the 13,000 level. The Nasdaq remains higher for the week, and on track for a four-week win streak.",0,1,Raw_Rain,StockMarket
